{
  "$schema": "./floor-plan.schema.json",
  "id": "studio-101",
  "version": "2026-07-24.1",
  "title": "Studio 101, TATA Innovation Center",
  "source": "Traced from the MakerLAB zone plan of 2026-07-24",
  "placeholder": false,
  "viewBox": {
    "x": 100,
    "y": 70,
    "w": 1130,
    "h": 1140
  },
  "outline": [
    [495, 100],
    [1200, 100],
    [1185, 1180],
    [125, 1030]
  ],
  "walls": [
    [[945, 100], [945, 1146]],
    [[945, 525], [1197, 525]],
    [[1035, 610], [1193, 610]],
    [[1035, 610], [1035, 710]],
    [[945, 710], [1035, 710]],
    [[945, 888], [1191, 888]],
    [[945, 1020], [1189, 1020]]
  ],
  "zones": [
    {
      "id": "Z1",
      "number": "1",
      "room": "Studio 101",
      "zone": "Common Purpose Space",
      "polygon": [
        [495, 100],
        [945, 100],
        [945, 865],
        [515, 865],
        [515, 1085],
        [125, 1030]
      ],
      "labelAt": [495, 617]
    },
    {
      "id": "Z2",
      "number": "2",
      "room": "Studio 101",
      "zone": "3D Printing Hub",
      "polygon": [
        [515, 865],
        [945, 865],
        [945, 1146],
        [515, 1085]
      ],
      "labelAt": [760, 975]
    },
    {
      "id": "Z3",
      "number": "3",
      "room": "Studio 101A",
      "zone": "Machining Shop",
      "polygon": [
        [945, 100],
        [1200, 100],
        [1197, 525],
        [945, 525]
      ],
      "labelAt": [1072, 330]
    },
    {
      "id": "Z4",
      "number": "4",
      "room": "Studio 101C",
      "zone": "Laser Machine Room",
      "polygon": [
        [1035, 610],
        [1193, 610],
        [1191, 888],
        [945, 888],
        [945, 710],
        [1035, 710]
      ],
      "labelAt": [1030, 790]
    },
    {
      "id": "Z5",
      "number": "5",
      "room": "Studio 101D",
      "zone": "Electronics Lab",
      "polygon": [
        [945, 888],
        [1191, 888],
        [1189, 1020],
        [945, 1020]
      ],
      "labelAt": [1030, 955]
    }
  ],
  "stations": [
    {
      "id": "1A",
      "label": "Lounge",
      "zoneId": "Z1",
      "marks": [
        [293, 948]
      ]
    },
    {
      "id": "1B",
      "label": "Office Hour Desk",
      "zoneId": "Z1",
      "marks": [
        [478, 893]
      ]
    },
    {
      "id": "1C",
      "label": "Vinyl Cutting Station",
      "zoneId": "Z1",
      "marks": [
        [353, 688]
      ]
    },
    {
      "id": "1D",
      "label": "Paper Prototyping Cart",
      "zoneId": "Z1",
      "marks": [
        [413, 546]
      ]
    },
    {
      "id": "1E",
      "label": "FirstAid | PPE | INFO Column",
      "zoneId": "Z1",
      "marks": [
        [556, 482]
      ]
    },
    {
      "id": "1F",
      "label": "Sewing Station",
      "zoneId": "Z1",
      "marks": [
        [507, 343]
      ]
    },
    {
      "id": "1G",
      "label": "3D Scanning & VR Station",
      "zoneId": "Z1",
      "marks": [[734, 215], [774, 392]]
    },
    {
      "id": "1H",
      "label": "Sink | Waste Disposal | Books",
      "zoneId": "Z1",
      "marks": [
        [985, 600]
      ]
    },
    {
      "id": "1J",
      "label": "Work Tables | Teaching Space",
      "zoneId": "Z1",
      "marks": [
        [675, 646]
      ]
    },
    {
      "id": "1K",
      "label": "Wood Working Hand Tools & Hardware",
      "zoneId": "Z1",
      "marks": [
        [890, 447]
      ]
    },
    {
      "id": "2A",
      "label": "FDM 3d Printers",
      "zoneId": "Z2",
      "marks": [
        [605, 882]
      ]
    },
    {
      "id": "2B",
      "label": "SLA 3d Printers",
      "zoneId": "Z2",
      "marks": [
        [711, 1052]
      ]
    },
    {
      "id": "3A",
      "label": "Shopbot CNC",
      "zoneId": "Z3",
      "marks": [
        [1080, 192]
      ]
    },
    {
      "id": "3B",
      "label": "Wazer Waterjet",
      "zoneId": "Z3",
      "marks": [
        [985, 466]
      ]
    },
    {
      "id": "3C",
      "label": "Power & Hand Tools",
      "zoneId": "Z3",
      "marks": [
        [1147, 415]
      ]
    },
    {
      "id": "4A",
      "label": "Trotec Laser Machine",
      "zoneId": "Z4",
      "marks": [
        [1130, 688]
      ]
    },
    {
      "id": "4B",
      "label": "Epilog Laser Machine",
      "zoneId": "Z4",
      "marks": [
        [1130, 843]
      ]
    }
  ]
}
